{"contract_version":"1.0","counts":{"changed":0,"effective_source_observation_count":0,"fresh":0,"fresh_emitted_operation_count":0,"new":0,"observation_count":0,"producer_retract":0,"retained":0,"scope_exit":0,"source_delete":0,"superseded":0,"upsert":0},"data_parts":[],"enrichment":{"deferred":0,"failed":0,"status":"not_requested","succeeded":0},"feed_id":"physical-ai-arxiv-facts-v1","manifest_schema_version":"1.0","partition_state":"provisional","previous_manifest_sha256":null,"producer":{"code_sha":"b022f9b096a80b5544459f5a9b294b49199f1b47","config_sha256":"sha256:9886466bf4ecf88f09af4356b9829cf1249093c7bffbcbd58659d3c92d3b2553","normalizer_version":"arxiv-feed-normalizer-v1","schema_sha256":"sha256:b25ebc96fd20e8664f75c56cde3e35be04c7b92d9154447db6bfb63db44407d7","workflow_run_id":"30192383240"},"projection_base_hash":"sha256:f668c0162a7291e43f61c0d929d1bf10bc3ee24453cacf5bd27890f5cd657221","projection_result_hash":"sha256:635f68ab09c70403b3a19616d3e2608805e47e128fb878509f7d13b45f4e1a2a","query":{"first_response_date":"2026-07-26T00:00:39Z","from":"2026-07-26","last_response_date":"2026-07-26T00:00:39Z","metadata_prefix":"arXivRaw","observed_complete_at":"2026-07-26T07:14:25Z","page_count":1,"set":null,"source_schema_sha256":"sha256:b1f24a0b763c16bd68ac1871fb08cc8f3eb70e859469bdabbce92fa3e2616d85","source_schema_url":"https://oaipmh.arxiv.org/OAI/arXivRaw.xsd","token_exhausted":true,"until":"2026-07-26"},"scope_id":"physical-ai-v1","source_date":"2026-07-26"}
