{"contract_version":"1.0","counts":{"changed":0,"effective_source_observation_count":786,"fresh":0,"fresh_emitted_operation_count":0,"new":0,"observation_count":786,"producer_retract":0,"retained":786,"scope_exit":0,"source_delete":0,"superseded":0,"upsert":786},"data_parts":[{"compressed_sha256":"sha256:6b9303f4f6db1595211ada4534668008b95b8686f7baf92cee9c1afc1ef1bce2","compressed_size":677048,"ordinal":0,"path":"objects/sha256/6b/6b9303f4f6db1595211ada4534668008b95b8686f7baf92cee9c1afc1ef1bce2.jsonl.gz","record_count":786,"uncompressed_sha256":"sha256:00b09822492a6f1cf09a1d016c7ff8582d0cf544d45443fc18cd38c755e2ebff","uncompressed_size":2118442}],"enrichment":{"deferred":0,"failed":0,"status":"not_requested","succeeded":0},"feed_id":"physical-ai-arxiv-facts-v1","manifest_schema_version":"1.0","partition_state":"closed_complete","previous_manifest_sha256":"sha256:411ea305491d0755e3c6e544f7a6c5d4dd2eb4dda8e43ded63261371c4a2904d","producer":{"code_sha":"1cdbe60d7fe8a6116fedb1de303ab69416ae65ce","config_sha256":"sha256:9886466bf4ecf88f09af4356b9829cf1249093c7bffbcbd58659d3c92d3b2553","normalizer_version":"arxiv-feed-normalizer-v1","schema_sha256":"sha256:b25ebc96fd20e8664f75c56cde3e35be04c7b92d9154447db6bfb63db44407d7","workflow_run_id":"31290661518"},"projection_base_hash":"sha256:07d55580f689a7fea426b9b80699551a42a47f7b6d34ff8555280d98f0c97ed6","projection_result_hash":"sha256:820c5ef16fe6887d04d4ea859c1daf40025b62b7f863060d6998dc5a0e9e2ef8","query":{"first_response_date":"2026-07-23T02:04:04Z","from":"2026-07-22","last_response_date":"2026-07-23T01:41:53Z","metadata_prefix":"arXivRaw","observed_complete_at":"2026-07-23T07:10:07Z","page_count":2,"set":null,"source_schema_sha256":"sha256:b1f24a0b763c16bd68ac1871fb08cc8f3eb70e859469bdabbce92fa3e2616d85","source_schema_url":"https://oaipmh.arxiv.org/OAI/arXivRaw.xsd","token_exhausted":true,"until":"2026-07-22"},"scope_id":"physical-ai-v1","source_date":"2026-07-22"}
