{"contract_version":"1.0","counts":{"changed":0,"effective_source_observation_count":2028,"fresh":2028,"fresh_emitted_operation_count":2028,"new":2028,"observation_count":2028,"producer_retract":0,"retained":0,"scope_exit":0,"source_delete":0,"superseded":0,"upsert":2028},"data_parts":[{"compressed_sha256":"sha256:6cd44c969b8a58fa132a15204d3f8e96a636a9a6dc177e5a6795632646ea7978","compressed_size":1708424,"ordinal":0,"path":"objects/sha256/6c/6cd44c969b8a58fa132a15204d3f8e96a636a9a6dc177e5a6795632646ea7978.jsonl.gz","record_count":2028,"uncompressed_sha256":"sha256:a3e198e2d389a72c221e5e85b603881dd81cf6357be189eb19fdc9efa8fc73ff","uncompressed_size":5406190}],"enrichment":{"deferred":0,"failed":0,"status":"not_requested","succeeded":0},"feed_id":"physical-ai-arxiv-facts-v1","manifest_schema_version":"1.0","partition_state":"closed_complete","previous_manifest_sha256":null,"producer":{"code_sha":"97d7e8e9a6aa4c55c4e2a29c53aa11069ee37af2","config_sha256":"sha256:9886466bf4ecf88f09af4356b9829cf1249093c7bffbcbd58659d3c92d3b2553","normalizer_version":"arxiv-feed-normalizer-v1","schema_sha256":"sha256:b25ebc96fd20e8664f75c56cde3e35be04c7b92d9154447db6bfb63db44407d7","workflow_run_id":"29398146123"},"projection_base_hash":"sha256:22b5d2ce83dfba5a65e199a65cc0235be8efac043dba6ca14fdda54924bdbbc4","projection_result_hash":"sha256:e934812f0f051c9889b5c58688a53c711bfde5b6ba74186c563f5aa137fc6cc5","query":{"first_response_date":"2026-07-15T07:41:40Z","from":"2026-07-07","last_response_date":"2026-07-15T07:42:02Z","metadata_prefix":"arXivRaw","observed_complete_at":"2026-07-15T07:42:03Z","page_count":4,"set":null,"source_schema_sha256":"sha256:b1f24a0b763c16bd68ac1871fb08cc8f3eb70e859469bdabbce92fa3e2616d85","source_schema_url":"https://oaipmh.arxiv.org/OAI/arXivRaw.xsd","token_exhausted":true,"until":"2026-07-07"},"scope_id":"physical-ai-v1","source_date":"2026-07-07"}
