{"contract_version":"1.0","counts":{"changed":0,"effective_source_observation_count":657,"fresh":0,"fresh_emitted_operation_count":0,"new":0,"observation_count":657,"producer_retract":0,"retained":657,"scope_exit":0,"source_delete":0,"superseded":0,"upsert":657},"data_parts":[{"compressed_sha256":"sha256:67ab6f4af550a7d616dc530df5541798c520b4eb0f134a8a0d503dabc4ff5119","compressed_size":566654,"ordinal":0,"path":"objects/sha256/67/67ab6f4af550a7d616dc530df5541798c520b4eb0f134a8a0d503dabc4ff5119.jsonl.gz","record_count":657,"uncompressed_sha256":"sha256:b80c65dcf795a12c6504299493ba4b190fc29041dc1d92f310140f3922a8874b","uncompressed_size":1769787}],"enrichment":{"deferred":0,"failed":0,"status":"not_requested","succeeded":0},"feed_id":"physical-ai-arxiv-facts-v1","manifest_schema_version":"1.0","partition_state":"closed_complete","previous_manifest_sha256":"sha256:e2cf6c63ea0d6cf08aa4b8c4c498dc77e14713c3d7f62959ccc7a50c0684d2a1","producer":{"code_sha":"1cdbe60d7fe8a6116fedb1de303ab69416ae65ce","config_sha256":"sha256:9886466bf4ecf88f09af4356b9829cf1249093c7bffbcbd58659d3c92d3b2553","normalizer_version":"arxiv-feed-normalizer-v1","schema_sha256":"sha256:b25ebc96fd20e8664f75c56cde3e35be04c7b92d9154447db6bfb63db44407d7","workflow_run_id":"33240466820"},"projection_base_hash":"sha256:4a130861b347fe944bfbb257299d6e9311cff7a1adac5eecc15f8df9e262f953","projection_result_hash":"sha256:070b99ff7a47088134dd6fc4e1be98b0b36c7f64dfa311c505351a97d448d90d","query":{"first_response_date":"2026-08-22T00:01:02Z","from":"2026-08-21","last_response_date":"2026-08-22T00:47:06Z","metadata_prefix":"arXivRaw","observed_complete_at":"2026-08-22T02:01:05Z","page_count":2,"set":null,"source_schema_sha256":"sha256:b1f24a0b763c16bd68ac1871fb08cc8f3eb70e859469bdabbce92fa3e2616d85","source_schema_url":"https://oaipmh.arxiv.org/OAI/arXivRaw.xsd","token_exhausted":true,"until":"2026-08-21"},"scope_id":"physical-ai-v1","source_date":"2026-08-21"}
