{"contract_version":"1.0","counts":{"changed":2,"effective_source_observation_count":922,"fresh":2,"fresh_emitted_operation_count":2,"new":0,"observation_count":922,"producer_retract":0,"retained":920,"scope_exit":0,"source_delete":0,"superseded":2,"upsert":922},"data_parts":[{"compressed_sha256":"sha256:f28a054e48409005ff5911055ce84253a269cc3ccbf94c522af804b65a23190c","compressed_size":803582,"ordinal":0,"path":"objects/sha256/f2/f28a054e48409005ff5911055ce84253a269cc3ccbf94c522af804b65a23190c.jsonl.gz","record_count":922,"uncompressed_sha256":"sha256:46766921a341eef8d23a37a0a47ee533de872ad9631d6f3f4ae3ca4512736c7a","uncompressed_size":2503652}],"enrichment":{"deferred":0,"failed":0,"status":"not_requested","succeeded":0},"feed_id":"physical-ai-arxiv-facts-v1","manifest_schema_version":"1.0","partition_state":"closed_complete","previous_manifest_sha256":"sha256:f39113684a626cd053e3085c01053efe769f6f4e0b3d85f9eb0efacd87f892dd","producer":{"code_sha":"1cdbe60d7fe8a6116fedb1de303ab69416ae65ce","config_sha256":"sha256:9886466bf4ecf88f09af4356b9829cf1249093c7bffbcbd58659d3c92d3b2553","normalizer_version":"arxiv-feed-normalizer-v1","schema_sha256":"sha256:b25ebc96fd20e8664f75c56cde3e35be04c7b92d9154447db6bfb63db44407d7","workflow_run_id":"31662971982"},"projection_base_hash":"sha256:e73ddf525d8aa6c280948c0740a0f3d318171e311263b7029fa260c202e1ac35","projection_result_hash":"sha256:6d2338cd15e8563a62c973faf76d7f570c72dc06bbb66bfa251e259f5834c618","query":{"first_response_date":"2026-08-13T02:02:07Z","from":"2026-08-12","last_response_date":"2026-08-13T01:55:03Z","metadata_prefix":"arXivRaw","observed_complete_at":"2026-08-13T03:10:53Z","page_count":2,"set":null,"source_schema_sha256":"sha256:b1f24a0b763c16bd68ac1871fb08cc8f3eb70e859469bdabbce92fa3e2616d85","source_schema_url":"https://oaipmh.arxiv.org/OAI/arXivRaw.xsd","token_exhausted":true,"until":"2026-08-12"},"scope_id":"physical-ai-v1","source_date":"2026-08-12"}
