{"contract_version":"1.0","counts":{"changed":244,"effective_source_observation_count":1482,"fresh":1482,"fresh_emitted_operation_count":1482,"new":1238,"observation_count":1482,"producer_retract":0,"retained":0,"scope_exit":0,"source_delete":0,"superseded":244,"upsert":1482},"data_parts":[{"compressed_sha256":"sha256:9296aebe0d11cfe31ba8bf88bc0dc6c3b66fec840d24b76344c2aa5d903525ed","compressed_size":1275959,"ordinal":0,"path":"objects/sha256/92/9296aebe0d11cfe31ba8bf88bc0dc6c3b66fec840d24b76344c2aa5d903525ed.jsonl.gz","record_count":1482,"uncompressed_sha256":"sha256:21eef1ed063777900f305351d68acb8399f9b1211359787cd5db4c3d22d2f83a","uncompressed_size":3990389}],"enrichment":{"deferred":0,"failed":0,"status":"not_requested","succeeded":0},"feed_id":"physical-ai-arxiv-facts-v1","manifest_schema_version":"1.0","partition_state":"closed_complete","previous_manifest_sha256":null,"producer":{"code_sha":"1cdbe60d7fe8a6116fedb1de303ab69416ae65ce","config_sha256":"sha256:9886466bf4ecf88f09af4356b9829cf1249093c7bffbcbd58659d3c92d3b2553","normalizer_version":"arxiv-feed-normalizer-v1","schema_sha256":"sha256:b25ebc96fd20e8664f75c56cde3e35be04c7b92d9154447db6bfb63db44407d7","workflow_run_id":"33240466820"},"projection_base_hash":"sha256:7cb0326639035e2dd802ca329d18b3a670ac325129690244889d54ca915ed9af","projection_result_hash":"sha256:ea12731c45de836a666cf653e89b3caf5e1e7b3df2e783cb615b800f81b8a515","query":{"first_response_date":"2026-08-28T06:24:55Z","from":"2026-08-25","last_response_date":"2026-08-28T06:25:10Z","metadata_prefix":"arXivRaw","observed_complete_at":"2026-08-29T07:19:24Z","page_count":3,"set":null,"source_schema_sha256":"sha256:b1f24a0b763c16bd68ac1871fb08cc8f3eb70e859469bdabbce92fa3e2616d85","source_schema_url":"https://oaipmh.arxiv.org/OAI/arXivRaw.xsd","token_exhausted":true,"until":"2026-08-25"},"scope_id":"physical-ai-v1","source_date":"2026-08-25"}
