{"contract_version":"1.0","counts":{"changed":2,"effective_source_observation_count":822,"fresh":2,"fresh_emitted_operation_count":2,"new":0,"observation_count":822,"producer_retract":0,"retained":820,"scope_exit":0,"source_delete":0,"superseded":2,"upsert":822},"data_parts":[{"compressed_sha256":"sha256:356b86ceed5da2f377fb039913f453a14a2b3aa076fcf0907ba8838d94f47967","compressed_size":711737,"ordinal":0,"path":"objects/sha256/35/356b86ceed5da2f377fb039913f453a14a2b3aa076fcf0907ba8838d94f47967.jsonl.gz","record_count":822,"uncompressed_sha256":"sha256:c27aa5e2afbbd67fec285656209fd1b457ff62ee3dcda668ad509a73ce3946b3","uncompressed_size":2214718}],"enrichment":{"deferred":0,"failed":0,"status":"not_requested","succeeded":0},"feed_id":"physical-ai-arxiv-facts-v1","manifest_schema_version":"1.0","partition_state":"closed_complete","previous_manifest_sha256":"sha256:23aba6445e5823f6295ef00617a0ca43ce52e2e6096a44ae663d399f2df66f85","producer":{"code_sha":"1cdbe60d7fe8a6116fedb1de303ab69416ae65ce","config_sha256":"sha256:9886466bf4ecf88f09af4356b9829cf1249093c7bffbcbd58659d3c92d3b2553","normalizer_version":"arxiv-feed-normalizer-v1","schema_sha256":"sha256:b25ebc96fd20e8664f75c56cde3e35be04c7b92d9154447db6bfb63db44407d7","workflow_run_id":"31857899771"},"projection_base_hash":"sha256:ba89d6e05c78c6b23a76cb7e795be671c6a5673655cbae7bef06fd147394f3d6","projection_result_hash":"sha256:528e7f3f2d053b2448e9b0c4b1d8433f89bd98c51861758c0999cad89354b82a","query":{"first_response_date":"2026-08-15T00:00:04Z","from":"2026-08-14","last_response_date":"2026-08-15T00:00:31Z","metadata_prefix":"arXivRaw","observed_complete_at":"2026-08-15T02:00:35Z","page_count":2,"set":null,"source_schema_sha256":"sha256:b1f24a0b763c16bd68ac1871fb08cc8f3eb70e859469bdabbce92fa3e2616d85","source_schema_url":"https://oaipmh.arxiv.org/OAI/arXivRaw.xsd","token_exhausted":true,"until":"2026-08-14"},"scope_id":"physical-ai-v1","source_date":"2026-08-14"}
