{"contract_version":"1.0","counts":{"changed":136,"effective_source_observation_count":824,"fresh":824,"fresh_emitted_operation_count":824,"new":688,"observation_count":824,"producer_retract":0,"retained":0,"scope_exit":0,"source_delete":0,"superseded":136,"upsert":824},"data_parts":[{"compressed_sha256":"sha256:a1cbbca03d9df8dbcaeafc94d9f475b3e1d92cc5978785b3e6be01ab2abc8088","compressed_size":712005,"ordinal":0,"path":"objects/sha256/a1/a1cbbca03d9df8dbcaeafc94d9f475b3e1d92cc5978785b3e6be01ab2abc8088.jsonl.gz","record_count":824,"uncompressed_sha256":"sha256:c10ee02ace057c20e0fd3749ef31f99da167a8b2c75143d7353b80a4a0be1af4","uncompressed_size":2225057}],"enrichment":{"deferred":0,"failed":0,"status":"not_requested","succeeded":0},"feed_id":"physical-ai-arxiv-facts-v1","manifest_schema_version":"1.0","partition_state":"provisional","previous_manifest_sha256":null,"producer":{"code_sha":"1cdbe60d7fe8a6116fedb1de303ab69416ae65ce","config_sha256":"sha256:9886466bf4ecf88f09af4356b9829cf1249093c7bffbcbd58659d3c92d3b2553","normalizer_version":"arxiv-feed-normalizer-v1","schema_sha256":"sha256:b25ebc96fd20e8664f75c56cde3e35be04c7b92d9154447db6bfb63db44407d7","workflow_run_id":"31069522728"},"projection_base_hash":"sha256:3b9fd7955362300395dd9773ae72b7f5a181b6d41473a8d17d0f59c0c4f8a20f","projection_result_hash":"sha256:fb96e6c3d7787d8c0cc62e9011feca1cda58c476fc409b67b6b5a9b9b39cf380","query":{"first_response_date":"2026-08-06T03:52:40Z","from":"2026-08-06","last_response_date":"2026-08-06T03:52:47Z","metadata_prefix":"arXivRaw","observed_complete_at":"2026-08-06T03:52:47Z","page_count":2,"set":null,"source_schema_sha256":"sha256:b1f24a0b763c16bd68ac1871fb08cc8f3eb70e859469bdabbce92fa3e2616d85","source_schema_url":"https://oaipmh.arxiv.org/OAI/arXivRaw.xsd","token_exhausted":true,"until":"2026-08-06"},"scope_id":"physical-ai-v1","source_date":"2026-08-06"}
