{"contract_version":"1.0","counts":{"changed":1,"effective_source_observation_count":797,"fresh":3,"fresh_emitted_operation_count":3,"new":2,"observation_count":797,"producer_retract":0,"retained":794,"scope_exit":0,"source_delete":0,"superseded":1,"upsert":797},"data_parts":[{"compressed_sha256":"sha256:6627b5abd80de1d309637d6d9c6441b8d492da0d33c67447d024dcdea6c7a82a","compressed_size":679289,"ordinal":0,"path":"objects/sha256/66/6627b5abd80de1d309637d6d9c6441b8d492da0d33c67447d024dcdea6c7a82a.jsonl.gz","record_count":797,"uncompressed_sha256":"sha256:03fd438bc4aebd698254b54d550e92af2bc4e484f7cba97e8643f54090cdc40f","uncompressed_size":2128580}],"enrichment":{"deferred":0,"failed":0,"status":"not_requested","succeeded":0},"feed_id":"physical-ai-arxiv-facts-v1","manifest_schema_version":"1.0","partition_state":"closed_complete","previous_manifest_sha256":"sha256:ebf9f566d135fba84c10edee890465d9c5aff15d3cc22e7d36820cbfdcb08e32","producer":{"code_sha":"b022f9b096a80b5544459f5a9b294b49199f1b47","config_sha256":"sha256:9886466bf4ecf88f09af4356b9829cf1249093c7bffbcbd58659d3c92d3b2553","normalizer_version":"arxiv-feed-normalizer-v1","schema_sha256":"sha256:b25ebc96fd20e8664f75c56cde3e35be04c7b92d9154447db6bfb63db44407d7","workflow_run_id":"30147902338"},"projection_base_hash":"sha256:8ba620c993a1acf3047053d8f896a651b39ecaba500468936289cdc145d717bc","projection_result_hash":"sha256:eed05df62eadebf2cb8c449bda70e939dea4d3b4c449db900e06e39a57ed29ce","query":{"first_response_date":"2026-07-25T06:43:18Z","from":"2026-07-24","last_response_date":"2026-07-25T00:05:18Z","metadata_prefix":"arXivRaw","observed_complete_at":"2026-07-25T06:43:45Z","page_count":2,"set":null,"source_schema_sha256":"sha256:b1f24a0b763c16bd68ac1871fb08cc8f3eb70e859469bdabbce92fa3e2616d85","source_schema_url":"https://oaipmh.arxiv.org/OAI/arXivRaw.xsd","token_exhausted":true,"until":"2026-07-24"},"scope_id":"physical-ai-v1","source_date":"2026-07-24"}
