{"contract_version":"1.0","counts":{"changed":0,"effective_source_observation_count":645,"fresh":645,"fresh_emitted_operation_count":645,"new":645,"observation_count":645,"producer_retract":0,"retained":0,"scope_exit":0,"source_delete":0,"superseded":0,"upsert":645},"data_parts":[{"compressed_sha256":"sha256:f1370e8d830441d856cd055c2c95416d3477e9407c7244ce4a4880830a61a005","compressed_size":539474,"ordinal":0,"path":"objects/sha256/f1/f1370e8d830441d856cd055c2c95416d3477e9407c7244ce4a4880830a61a005.jsonl.gz","record_count":645,"uncompressed_sha256":"sha256:a396d03eddf6be7369b72d73585f982f494ebf120d76a96df20c8f043eaa741b","uncompressed_size":1705500}],"enrichment":{"deferred":0,"failed":0,"status":"not_requested","succeeded":0},"feed_id":"physical-ai-arxiv-facts-v1","manifest_schema_version":"1.0","partition_state":"closed_complete","previous_manifest_sha256":null,"producer":{"code_sha":"56d54df04e2f980c42cfba07f1fbe925d390b724","config_sha256":"sha256:9886466bf4ecf88f09af4356b9829cf1249093c7bffbcbd58659d3c92d3b2553","normalizer_version":"arxiv-feed-normalizer-v1","schema_sha256":"sha256:b25ebc96fd20e8664f75c56cde3e35be04c7b92d9154447db6bfb63db44407d7","workflow_run_id":"29324804933"},"projection_base_hash":"sha256:e36fb8e64bb64fb53c3b22c46e4c6e006a480b6998aa3ed3356f122fc7839d39","projection_result_hash":"sha256:a27c4916a2ba0c7506d94808ce3ecfa12f255a0dd2215cca3a1ecbc4081744bc","query":{"first_response_date":"2026-07-14T10:13:44Z","from":"2026-06-15","last_response_date":"2026-07-14T10:13:52Z","metadata_prefix":"arXivRaw","observed_complete_at":"2026-07-14T10:17:33Z","page_count":2,"set":null,"source_schema_sha256":"sha256:b1f24a0b763c16bd68ac1871fb08cc8f3eb70e859469bdabbce92fa3e2616d85","source_schema_url":"https://oaipmh.arxiv.org/OAI/arXivRaw.xsd","token_exhausted":true,"until":"2026-06-15"},"scope_id":"physical-ai-v1","source_date":"2026-06-15"}
