{"contract_version":"1.0","counts":{"changed":1,"effective_source_observation_count":1107,"fresh":2,"fresh_emitted_operation_count":2,"new":1,"observation_count":1107,"producer_retract":0,"retained":1105,"scope_exit":1,"source_delete":0,"superseded":1,"upsert":1106},"data_parts":[{"compressed_sha256":"sha256:ea3f42d8d06a8be42e7b7483c9840b4c6d2981b7fe66e518d017dce81a153cd8","compressed_size":937325,"ordinal":0,"path":"objects/sha256/ea/ea3f42d8d06a8be42e7b7483c9840b4c6d2981b7fe66e518d017dce81a153cd8.jsonl.gz","record_count":1107,"uncompressed_sha256":"sha256:b9fdeb80e0138e1c9b6f547d21e3a3e03376eebd5ece652b328c52876887aeea","uncompressed_size":2930161}],"enrichment":{"deferred":0,"failed":0,"status":"not_requested","succeeded":0},"feed_id":"physical-ai-arxiv-facts-v1","manifest_schema_version":"1.0","partition_state":"closed_complete","previous_manifest_sha256":"sha256:c3f5c325f9c6b21d06f1b86f0f82e245a0ed3ae5f9f9c4f57d5d28e8ddfd5233","producer":{"code_sha":"1cdbe60d7fe8a6116fedb1de303ab69416ae65ce","config_sha256":"sha256:9886466bf4ecf88f09af4356b9829cf1249093c7bffbcbd58659d3c92d3b2553","normalizer_version":"arxiv-feed-normalizer-v1","schema_sha256":"sha256:b25ebc96fd20e8664f75c56cde3e35be04c7b92d9154447db6bfb63db44407d7","workflow_run_id":"33716661769"},"projection_base_hash":"sha256:c85dd2f4c06efd4dc091549fa7bb178259ad87b0c188149631bab768185688f7","projection_result_hash":"sha256:4570a97ea3b8c9fa1b65a3eb43ba63fa4349bcb41f6de30ee6e407b81cc5da69","query":{"first_response_date":"2026-09-03T02:02:21Z","from":"2026-09-02","last_response_date":"2026-09-03T02:02:30Z","metadata_prefix":"arXivRaw","observed_complete_at":"2026-09-03T04:56:03Z","page_count":3,"set":null,"source_schema_sha256":"sha256:b1f24a0b763c16bd68ac1871fb08cc8f3eb70e859469bdabbce92fa3e2616d85","source_schema_url":"https://oaipmh.arxiv.org/OAI/arXivRaw.xsd","token_exhausted":true,"until":"2026-09-02"},"scope_id":"physical-ai-v1","source_date":"2026-09-02"}
