{"contract_version":"1.0","counts":{"changed":1,"effective_source_observation_count":1887,"fresh":1,"fresh_emitted_operation_count":1,"new":0,"observation_count":1887,"producer_retract":0,"retained":1886,"scope_exit":0,"source_delete":0,"superseded":1,"upsert":1887},"data_parts":[{"compressed_sha256":"sha256:6aa7f9bae1caae72e17dd7542b8e4e1ea56ad2e894c3f2d28eb20c0ffa18cd9f","compressed_size":1642932,"ordinal":0,"path":"objects/sha256/6a/6aa7f9bae1caae72e17dd7542b8e4e1ea56ad2e894c3f2d28eb20c0ffa18cd9f.jsonl.gz","record_count":1887,"uncompressed_sha256":"sha256:58d9bc0e4cedab153f66a40892683f124bd6e7e44a3767d271a45a0d86e9a20e","uncompressed_size":5122034}],"enrichment":{"deferred":0,"failed":0,"status":"not_requested","succeeded":0},"feed_id":"physical-ai-arxiv-facts-v1","manifest_schema_version":"1.0","partition_state":"closed_complete","previous_manifest_sha256":"sha256:604cd0e7df949bdab7e5a64e6c860175796641e5a9b7f575b0eb6d2381eee0b9","producer":{"code_sha":"1cdbe60d7fe8a6116fedb1de303ab69416ae65ce","config_sha256":"sha256:9886466bf4ecf88f09af4356b9829cf1249093c7bffbcbd58659d3c92d3b2553","normalizer_version":"arxiv-feed-normalizer-v1","schema_sha256":"sha256:b25ebc96fd20e8664f75c56cde3e35be04c7b92d9154447db6bfb63db44407d7","workflow_run_id":"31558920105"},"projection_base_hash":"sha256:b0d3fc89aa386b7b8ebe3995550f9ab49a60ea24f2e247fab8f68076fba49e6e","projection_result_hash":"sha256:e73ddf525d8aa6c280948c0740a0f3d318171e311263b7029fa260c202e1ac35","query":{"first_response_date":"2026-08-12T02:02:17Z","from":"2026-08-11","last_response_date":"2026-08-12T02:02:30Z","metadata_prefix":"arXivRaw","observed_complete_at":"2026-08-12T03:07:03Z","page_count":4,"set":null,"source_schema_sha256":"sha256:b1f24a0b763c16bd68ac1871fb08cc8f3eb70e859469bdabbce92fa3e2616d85","source_schema_url":"https://oaipmh.arxiv.org/OAI/arXivRaw.xsd","token_exhausted":true,"until":"2026-08-11"},"scope_id":"physical-ai-v1","source_date":"2026-08-11"}
