{"contract_version":"1.0","counts":{"changed":95,"effective_source_observation_count":595,"fresh":595,"fresh_emitted_operation_count":595,"new":500,"observation_count":595,"producer_retract":0,"retained":0,"scope_exit":0,"source_delete":0,"superseded":95,"upsert":595},"data_parts":[{"compressed_sha256":"sha256:f9c0cbcb0c0aa9189e549721941da8b4cfee0cb85a81d545e7b868deb34aa85d","compressed_size":516653,"ordinal":0,"path":"objects/sha256/f9/f9c0cbcb0c0aa9189e549721941da8b4cfee0cb85a81d545e7b868deb34aa85d.jsonl.gz","record_count":595,"uncompressed_sha256":"sha256:811e11d8f5e9f96abc67f7f9f5e95f444a15d007f0494b60f684bfee0a3af155","uncompressed_size":1607330}],"enrichment":{"deferred":0,"failed":0,"status":"not_requested","succeeded":0},"feed_id":"physical-ai-arxiv-facts-v1","manifest_schema_version":"1.0","partition_state":"closed_complete","previous_manifest_sha256":"sha256:1c59711fa489a5cf927c7d9f1c2443f2af0a02814715aa90a77b8414239ef874","producer":{"code_sha":"b022f9b096a80b5544459f5a9b294b49199f1b47","config_sha256":"sha256:9886466bf4ecf88f09af4356b9829cf1249093c7bffbcbd58659d3c92d3b2553","normalizer_version":"arxiv-feed-normalizer-v1","schema_sha256":"sha256:b25ebc96fd20e8664f75c56cde3e35be04c7b92d9154447db6bfb63db44407d7","workflow_run_id":"30337836248"},"projection_base_hash":"sha256:635f68ab09c70403b3a19616d3e2608805e47e128fb878509f7d13b45f4e1a2a","projection_result_hash":"sha256:f8c91ec553b247fb3efec6fad9a043aacd154c16ef0d893ee254fe9299085f66","query":{"first_response_date":"2026-07-28T03:00:07Z","from":"2026-07-27","last_response_date":"2026-07-28T03:00:44Z","metadata_prefix":"arXivRaw","observed_complete_at":"2026-07-28T07:19:26Z","page_count":2,"set":null,"source_schema_sha256":"sha256:b1f24a0b763c16bd68ac1871fb08cc8f3eb70e859469bdabbce92fa3e2616d85","source_schema_url":"https://oaipmh.arxiv.org/OAI/arXivRaw.xsd","token_exhausted":true,"until":"2026-07-27"},"scope_id":"physical-ai-v1","source_date":"2026-07-27"}
