{"contract_version":"1.0","counts":{"changed":96,"effective_source_observation_count":704,"fresh":704,"fresh_emitted_operation_count":704,"new":608,"observation_count":704,"producer_retract":0,"retained":0,"scope_exit":0,"source_delete":0,"superseded":96,"upsert":704},"data_parts":[{"compressed_sha256":"sha256:c656f7b38b122db138da884e4b66f0f398be0fa3798123d0cf5cb61d255d9d12","compressed_size":602230,"ordinal":0,"path":"objects/sha256/c6/c656f7b38b122db138da884e4b66f0f398be0fa3798123d0cf5cb61d255d9d12.jsonl.gz","record_count":704,"uncompressed_sha256":"sha256:bc21020063a2d6f52761a2e0b4024de30bb74304813afa2414e1eb11046c034f","uncompressed_size":1886489}],"enrichment":{"deferred":0,"failed":0,"status":"not_requested","succeeded":0},"feed_id":"physical-ai-arxiv-facts-v1","manifest_schema_version":"1.0","partition_state":"closed_complete","previous_manifest_sha256":"sha256:b34c0e8dff9aa4e53d01967e9b6a07c7c082c5e0788983fa20d7996304df5ff1","producer":{"code_sha":"1cdbe60d7fe8a6116fedb1de303ab69416ae65ce","config_sha256":"sha256:9886466bf4ecf88f09af4356b9829cf1249093c7bffbcbd58659d3c92d3b2553","normalizer_version":"arxiv-feed-normalizer-v1","schema_sha256":"sha256:b25ebc96fd20e8664f75c56cde3e35be04c7b92d9154447db6bfb63db44407d7","workflow_run_id":"33592669348"},"projection_base_hash":"sha256:939bc47f696bd8a410aa12a93cb0655f4e9aaa763755f196affa246e00e401ad","projection_result_hash":"sha256:5d9998244e3a077511bf21229c2f8ef914db60630da9d83b2f983886150ccce1","query":{"first_response_date":"2026-09-02T03:11:34Z","from":"2026-08-31","last_response_date":"2026-09-02T02:16:43Z","metadata_prefix":"arXivRaw","observed_complete_at":"2026-09-02T04:58:25Z","page_count":2,"set":null,"source_schema_sha256":"sha256:b1f24a0b763c16bd68ac1871fb08cc8f3eb70e859469bdabbce92fa3e2616d85","source_schema_url":"https://oaipmh.arxiv.org/OAI/arXivRaw.xsd","token_exhausted":true,"until":"2026-08-31"},"scope_id":"physical-ai-v1","source_date":"2026-08-31"}
