{"contract_version":"1.0","counts":{"changed":1,"effective_source_observation_count":1,"fresh":1,"fresh_emitted_operation_count":1,"new":0,"observation_count":1,"producer_retract":0,"retained":0,"scope_exit":0,"source_delete":0,"superseded":1,"upsert":1},"data_parts":[{"compressed_sha256":"sha256:85247aa6e1b0c432653a69c753ebbedebab03bfbbcf3bebeed1b66391132a02b","compressed_size":1548,"ordinal":0,"path":"objects/sha256/85/85247aa6e1b0c432653a69c753ebbedebab03bfbbcf3bebeed1b66391132a02b.jsonl.gz","record_count":1,"uncompressed_sha256":"sha256:a66f885e73a0b569488618a3d409ae8d364226b97e09d45e89bcebb7f1a6f95c","uncompressed_size":2766}],"enrichment":{"deferred":0,"failed":0,"status":"not_requested","succeeded":0},"feed_id":"physical-ai-arxiv-facts-v1","manifest_schema_version":"1.0","partition_state":"closed_complete","previous_manifest_sha256":"sha256:d7da795e5eeb6bfbd643b9e2db62b9089db80084885e522e4fa6381e0dff8d60","producer":{"code_sha":"1cdbe60d7fe8a6116fedb1de303ab69416ae65ce","config_sha256":"sha256:9886466bf4ecf88f09af4356b9829cf1249093c7bffbcbd58659d3c92d3b2553","normalizer_version":"arxiv-feed-normalizer-v1","schema_sha256":"sha256:b25ebc96fd20e8664f75c56cde3e35be04c7b92d9154447db6bfb63db44407d7","workflow_run_id":"31290661518"},"projection_base_hash":"sha256:c39d56425b76a15bd4d85d399c7ec8f5a5905110480c98f32f247232a920059d","projection_result_hash":"sha256:97313b79c74198a5583bdebddd234859264968640b92c3fe282b06c02d588a90","query":{"first_response_date":"2026-08-09T00:04:21Z","from":"2026-08-08","last_response_date":"2026-08-09T00:04:21Z","metadata_prefix":"arXivRaw","observed_complete_at":"2026-08-09T02:37:54Z","page_count":1,"set":null,"source_schema_sha256":"sha256:b1f24a0b763c16bd68ac1871fb08cc8f3eb70e859469bdabbce92fa3e2616d85","source_schema_url":"https://oaipmh.arxiv.org/OAI/arXivRaw.xsd","token_exhausted":true,"until":"2026-08-08"},"scope_id":"physical-ai-v1","source_date":"2026-08-08"}
