{"contract_version":"1.0","counts":{"changed":135,"effective_source_observation_count":698,"fresh":698,"fresh_emitted_operation_count":698,"new":563,"observation_count":698,"producer_retract":0,"retained":0,"scope_exit":0,"source_delete":0,"superseded":135,"upsert":698},"data_parts":[{"compressed_sha256":"sha256:b1cf47149a6de1c16bef9d2a48f0dfbd942f208f6a9d6093711e7a1d7129bf62","compressed_size":600712,"ordinal":0,"path":"objects/sha256/b1/b1cf47149a6de1c16bef9d2a48f0dfbd942f208f6a9d6093711e7a1d7129bf62.jsonl.gz","record_count":698,"uncompressed_sha256":"sha256:0cc7d1c865d347f4b95e8701c691d417058a19c66c0768eca13e1a579d67c016","uncompressed_size":1877875}],"enrichment":{"deferred":0,"failed":0,"status":"not_requested","succeeded":0},"feed_id":"physical-ai-arxiv-facts-v1","manifest_schema_version":"1.0","partition_state":"provisional","previous_manifest_sha256":null,"producer":{"code_sha":"5a541b0c85061582f05c6f3deaaee76799893119","config_sha256":"sha256:9886466bf4ecf88f09af4356b9829cf1249093c7bffbcbd58659d3c92d3b2553","normalizer_version":"arxiv-feed-normalizer-v1","schema_sha256":"sha256:b25ebc96fd20e8664f75c56cde3e35be04c7b92d9154447db6bfb63db44407d7","workflow_run_id":"29478618890"},"projection_base_hash":"sha256:923ec351f3ec9d8d08de7e52e96fe19687733e50c31d1374d57d117b618c81d4","projection_result_hash":"sha256:05997fc986e44a195747245a5418f10776a5f32f455d1a5b80fc6da8758a1304","query":{"first_response_date":"2026-07-16T07:02:32Z","from":"2026-07-16","last_response_date":"2026-07-16T06:36:15Z","metadata_prefix":"arXivRaw","observed_complete_at":"2026-07-16T07:04:48Z","page_count":2,"set":null,"source_schema_sha256":"sha256:b1f24a0b763c16bd68ac1871fb08cc8f3eb70e859469bdabbce92fa3e2616d85","source_schema_url":"https://oaipmh.arxiv.org/OAI/arXivRaw.xsd","token_exhausted":true,"until":"2026-07-16"},"scope_id":"physical-ai-v1","source_date":"2026-07-16"}
