{"contract_version":"1.0","counts":{"changed":1,"effective_source_observation_count":826,"fresh":2,"fresh_emitted_operation_count":2,"new":1,"observation_count":826,"producer_retract":0,"retained":824,"scope_exit":0,"source_delete":0,"superseded":1,"upsert":826},"data_parts":[{"compressed_sha256":"sha256:bb0fcd622075b87a8b243c7aab1465c6fb3b26b82378b2fe87c36a4c3f9f66e6","compressed_size":714037,"ordinal":0,"path":"objects/sha256/bb/bb0fcd622075b87a8b243c7aab1465c6fb3b26b82378b2fe87c36a4c3f9f66e6.jsonl.gz","record_count":826,"uncompressed_sha256":"sha256:0cb91d8ea347c36000dcd227fac6dae9f5a5108f959a07c68f0ab14870ad8e78","uncompressed_size":2231046}],"enrichment":{"deferred":0,"failed":0,"status":"not_requested","succeeded":0},"feed_id":"physical-ai-arxiv-facts-v1","manifest_schema_version":"1.0","partition_state":"closed_complete","previous_manifest_sha256":"sha256:fb35004af9fa18afbebc57490e46d1b0926db9b7f6f9b8719945c263fdfb6fc1","producer":{"code_sha":"1cdbe60d7fe8a6116fedb1de303ab69416ae65ce","config_sha256":"sha256:9886466bf4ecf88f09af4356b9829cf1249093c7bffbcbd58659d3c92d3b2553","normalizer_version":"arxiv-feed-normalizer-v1","schema_sha256":"sha256:b25ebc96fd20e8664f75c56cde3e35be04c7b92d9154447db6bfb63db44407d7","workflow_run_id":"31144486914"},"projection_base_hash":"sha256:3b9fd7955362300395dd9773ae72b7f5a181b6d41473a8d17d0f59c0c4f8a20f","projection_result_hash":"sha256:f83f9d27f314cbab4a57ba0b25e0012a00add58b93e060556b79cffa33986c67","query":{"first_response_date":"2026-08-07T02:02:08Z","from":"2026-08-06","last_response_date":"2026-08-07T01:45:10Z","metadata_prefix":"arXivRaw","observed_complete_at":"2026-08-07T03:31:48Z","page_count":2,"set":null,"source_schema_sha256":"sha256:b1f24a0b763c16bd68ac1871fb08cc8f3eb70e859469bdabbce92fa3e2616d85","source_schema_url":"https://oaipmh.arxiv.org/OAI/arXivRaw.xsd","token_exhausted":true,"until":"2026-08-06"},"scope_id":"physical-ai-v1","source_date":"2026-08-06"}
