{"contract_version":"1.0","counts":{"changed":0,"effective_source_observation_count":728,"fresh":0,"fresh_emitted_operation_count":0,"new":0,"observation_count":728,"producer_retract":0,"retained":728,"scope_exit":0,"source_delete":0,"superseded":0,"upsert":728},"data_parts":[{"compressed_sha256":"sha256:2a9a30ec804bd404d8638f7c99a27d4e30d7dd1831b44068448a0d3c3ef6ee3a","compressed_size":628295,"ordinal":0,"path":"objects/sha256/2a/2a9a30ec804bd404d8638f7c99a27d4e30d7dd1831b44068448a0d3c3ef6ee3a.jsonl.gz","record_count":728,"uncompressed_sha256":"sha256:de77f72e88d614988352789b65c51606340990bbe3dde52d70f3f1b1d4e78c89","uncompressed_size":1954078}],"enrichment":{"deferred":0,"failed":0,"status":"not_requested","succeeded":0},"feed_id":"physical-ai-arxiv-facts-v1","manifest_schema_version":"1.0","partition_state":"closed_complete","previous_manifest_sha256":"sha256:2ca002aaae2bf4afd4b2e88abdd339bae622157ae96b71f65bd33863626d7c29","producer":{"code_sha":"1cdbe60d7fe8a6116fedb1de303ab69416ae65ce","config_sha256":"sha256:9886466bf4ecf88f09af4356b9829cf1249093c7bffbcbd58659d3c92d3b2553","normalizer_version":"arxiv-feed-normalizer-v1","schema_sha256":"sha256:b25ebc96fd20e8664f75c56cde3e35be04c7b92d9154447db6bfb63db44407d7","workflow_run_id":"32438759498"},"projection_base_hash":"sha256:09c5e0eae1574a72ec7613be6c3b47b11c8765bd54c17a2aa786e3d5d00eb5c7","projection_result_hash":"sha256:4a130861b347fe944bfbb257299d6e9311cff7a1adac5eecc15f8df9e262f953","query":{"first_response_date":"2026-08-21T02:01:54Z","from":"2026-08-20","last_response_date":"2026-08-21T01:46:53Z","metadata_prefix":"arXivRaw","observed_complete_at":"2026-08-21T02:11:20Z","page_count":2,"set":null,"source_schema_sha256":"sha256:b1f24a0b763c16bd68ac1871fb08cc8f3eb70e859469bdabbce92fa3e2616d85","source_schema_url":"https://oaipmh.arxiv.org/OAI/arXivRaw.xsd","token_exhausted":true,"until":"2026-08-20"},"scope_id":"physical-ai-v1","source_date":"2026-08-20"}
