{"contract_version":"1.0","counts":{"changed":0,"effective_source_observation_count":754,"fresh":0,"fresh_emitted_operation_count":0,"new":0,"observation_count":754,"producer_retract":0,"retained":754,"scope_exit":0,"source_delete":0,"superseded":0,"upsert":754},"data_parts":[{"compressed_sha256":"sha256:f705982ed610faf5c128bc48e9c7ece3c2f8fb6d671379895c5feecafa7f4d1e","compressed_size":656910,"ordinal":0,"path":"objects/sha256/f7/f705982ed610faf5c128bc48e9c7ece3c2f8fb6d671379895c5feecafa7f4d1e.jsonl.gz","record_count":754,"uncompressed_sha256":"sha256:b4d638f1d9103da56df3bf356b22c7cab52a99f35138096346e86a31e1414d69","uncompressed_size":2048671}],"enrichment":{"deferred":0,"failed":0,"status":"not_requested","succeeded":0},"feed_id":"physical-ai-arxiv-facts-v1","manifest_schema_version":"1.0","partition_state":"closed_complete","previous_manifest_sha256":"sha256:f0b9d317ca79c178fae71b5230d6db35ebe40dd399bc13f00145355315508aca","producer":{"code_sha":"1cdbe60d7fe8a6116fedb1de303ab69416ae65ce","config_sha256":"sha256:9886466bf4ecf88f09af4356b9829cf1249093c7bffbcbd58659d3c92d3b2553","normalizer_version":"arxiv-feed-normalizer-v1","schema_sha256":"sha256:b25ebc96fd20e8664f75c56cde3e35be04c7b92d9154447db6bfb63db44407d7","workflow_run_id":"31452818584"},"projection_base_hash":"sha256:477b7b2d8a78c237af73105a512632e99d0b223ac6e5f13ac2b6a655caaa13f5","projection_result_hash":"sha256:b0d3fc89aa386b7b8ebe3995550f9ab49a60ea24f2e247fab8f68076fba49e6e","query":{"first_response_date":"2026-08-11T00:00:42Z","from":"2026-08-10","last_response_date":"2026-08-11T00:05:01Z","metadata_prefix":"arXivRaw","observed_complete_at":"2026-08-11T02:38:01Z","page_count":2,"set":null,"source_schema_sha256":"sha256:b1f24a0b763c16bd68ac1871fb08cc8f3eb70e859469bdabbce92fa3e2616d85","source_schema_url":"https://oaipmh.arxiv.org/OAI/arXivRaw.xsd","token_exhausted":true,"until":"2026-08-10"},"scope_id":"physical-ai-v1","source_date":"2026-08-10"}
