{"contract_version":"1.0","counts":{"changed":3,"effective_source_observation_count":660,"fresh":3,"fresh_emitted_operation_count":3,"new":0,"observation_count":660,"producer_retract":0,"retained":657,"scope_exit":0,"source_delete":0,"superseded":3,"upsert":660},"data_parts":[{"compressed_sha256":"sha256:37d24f353c6c013f3b5586b351d8b37f4e540d6509b3bb4855776aac87315d95","compressed_size":568703,"ordinal":0,"path":"objects/sha256/37/37d24f353c6c013f3b5586b351d8b37f4e540d6509b3bb4855776aac87315d95.jsonl.gz","record_count":660,"uncompressed_sha256":"sha256:22c0ab6d3933241a4e132d60f1430fc13415f1899ce368b3bb070b985a5a08a8","uncompressed_size":1774357}],"enrichment":{"deferred":0,"failed":0,"status":"not_requested","succeeded":0},"feed_id":"physical-ai-arxiv-facts-v1","manifest_schema_version":"1.0","partition_state":"closed_complete","previous_manifest_sha256":"sha256:e12e82ae48b45a49cd07881ba56d7359ab3fd276d6fb0bfa493cff8cb57cd6d0","producer":{"code_sha":"1cdbe60d7fe8a6116fedb1de303ab69416ae65ce","config_sha256":"sha256:9886466bf4ecf88f09af4356b9829cf1249093c7bffbcbd58659d3c92d3b2553","normalizer_version":"arxiv-feed-normalizer-v1","schema_sha256":"sha256:b25ebc96fd20e8664f75c56cde3e35be04c7b92d9154447db6bfb63db44407d7","workflow_run_id":"32090089726"},"projection_base_hash":"sha256:5df67810afb6e6b37c32b919c2da91057d490857b13600ca318155d33275ac28","projection_result_hash":"sha256:4b8edddeb457748e9fa8560cec92492052731ab9e40c479c5ec249ceacbcdab5","query":{"first_response_date":"2026-08-18T00:00:05Z","from":"2026-08-17","last_response_date":"2026-08-18T00:00:25Z","metadata_prefix":"arXivRaw","observed_complete_at":"2026-08-18T02:00:57Z","page_count":2,"set":null,"source_schema_sha256":"sha256:b1f24a0b763c16bd68ac1871fb08cc8f3eb70e859469bdabbce92fa3e2616d85","source_schema_url":"https://oaipmh.arxiv.org/OAI/arXivRaw.xsd","token_exhausted":true,"until":"2026-08-17"},"scope_id":"physical-ai-v1","source_date":"2026-08-17"}
